{
  "$schema": "https://json-schema.org/draft/2020-12/schema",
  "title": "Evidence Review Pack Evidence Index",
  "type": "object",
  "additionalProperties": false,
  "required": ["schema_version", "review_id", "entries", "canonicality", "load_source"],
  "properties": {
    "schema_version": { "const": "evidence_index.v1" },
    "review_id": { "type": "string", "minLength": 1 },
    "entries": {
      "type": "array",
      "items": {
        "type": "object",
        "required": ["path", "kind"],
        "properties": {
          "path": { "$ref": "#/$defs/repositoryRelativePath" },
          "kind": { "type": "string", "minLength": 1 }
        }
      }
    },
    "canonicality": { "$ref": "#/$defs/canonicality" },
    "load_source": { "$ref": "#/$defs/loadSource" }
  },
  "$defs": {
    "repositoryRelativePath": {
      "type": "string",
      "pattern": "^(?!/)(?![A-Za-z]:)(?!.*\\\\)(?!.*://)(?!.*(^|/)\\.\\.(/|$)).+"
    },
    "canonicality": {
      "type": "object",
      "required": ["schema_version", "derived_class", "non_authoritative", "write_back_forbidden", "rebuildable"],
      "properties": {
        "schema_version": { "const": "canonicality.v1" },
        "derived_class": { "const": "review_pack" },
        "non_authoritative": { "const": true },
        "write_back_forbidden": { "const": true },
        "rebuildable": { "const": true }
      }
    },
    "loadSource": {
      "type": "object",
      "required": ["schema_version", "loaded_from", "canonical_source", "non_authoritative"],
      "properties": {
        "schema_version": { "const": "load_source.v1" },
        "loaded_from": { "const": "review_pack" },
        "canonical_source": { "const": "artifacts" },
        "non_authoritative": { "const": true }
      }
    }
  }
}
